{
  "id": "eval-028-high-04",
  "category": "high_tier",
  "tags": [
    "stable"
  ],
  "prompt": "Design a system design proposal for cross-service event delivery with rollback strategy.",
  "expected": {
    "tier": "high",
    "score_min": 0.85,
    "score_max": 0.95,
    "urgency_expected": false,
    "fanout_expected": "none"
  }
}
