{
  "id": "eval-028-low-02",
  "category": "low_tier",
  "tags": [
    "stable"
  ],
  "prompt": "Add a docstring to the parse_config function.",
  "expected": {
    "tier": "low",
    "score_min": 0.14,
    "score_max": 0.16,
    "urgency_expected": false,
    "fanout_expected": "favor_parallel"
  }
}
