{
  "id": "eval-028-high-07",
  "category": "high_tier",
  "tags": [
    "boundary"
  ],
  "prompt": "Design whether a shared job runner should stay synchronous or move to queued retries across two modules.",
  "expected": {
    "tier": "high",
    "score_min": 0.85,
    "score_max": 0.95,
    "urgency_expected": false,
    "fanout_expected": "none"
  }
}
