{
  "id": "eval-028-high-02",
  "category": "high_tier",
  "tags": [
    "stable"
  ],
  "prompt": "Perform a security review of an admin platform and identify likely misconfigurations plus mitigations.",
  "expected": {
    "tier": "high",
    "score_min": 0.85,
    "score_max": 0.95,
    "urgency_expected": false,
    "fanout_expected": "none"
  }
}
