{
  "id": "eval-028-med-03",
  "category": "medium_tier",
  "tags": [
    "stable"
  ],
  "prompt": "Integrate error handling across api.py service.py cli.py and add a validation-focused test suite for the new responses.",
  "expected": {
    "tier": "medium",
    "score_min": 0.63,
    "score_max": 0.71,
    "urgency_expected": false,
    "fanout_expected": "favor_parallel"
  }
}
