{
  "id": "eval-028-med-01",
  "category": "medium_tier",
  "tags": [
    "stable"
  ],
  "prompt": "Implement authentication middleware across auth_login.py auth_token.py auth_middleware.py and migrate callers to the new validation flow.",
  "expected": {
    "tier": "medium",
    "score_min": 0.64,
    "score_max": 0.72,
    "urgency_expected": false,
    "fanout_expected": "favor_parallel"
  }
}
