{
  "id": "eval-028-high-01",
  "category": "high_tier",
  "tags": [
    "stable"
  ],
  "prompt": "Architect a migration plan to split a monolithic service into two services with API compatibility milestones.",
  "expected": {
    "tier": "high",
    "score_min": 0.85,
    "score_max": 0.95,
    "urgency_expected": false,
    "fanout_expected": "none"
  }
}
