{
  "id": "eval-028-high-06",
  "category": "high_tier",
  "tags": [
    "stable"
  ],
  "prompt": "Architect a cross-service rollout plan for a database-backed platform with compliance constraints.",
  "expected": {
    "tier": "high",
    "score_min": 0.85,
    "score_max": 0.95,
    "urgency_expected": false,
    "fanout_expected": "none"
  }
}
